{
  "$schema": "https://json-schema.org/draft/2020-12/schema",
  "$id": "https://github.com/rchrdchn/hexkey/schema/catalog-spec.schema.json",
  "title": "Hexkey catalog spec",
  "description": "A short description of one piece: archetype + product-page dimensions + options. scripts/generate.mjs expands it into public/pieces/<slug>/piece.json. Write every word yourself; use only public facts (names, dimensions, hardware types and counts).",
  "type": "object",
  "required": ["slug", "name", "title", "archetype", "category", "size", "worksWith", "productUrl", "confidence", "sources"],
  "properties": {
    "slug": { "type": "string", "pattern": "^[a-z0-9-]+$" },
    "name": { "type": "string" },
    "title": { "type": "string" },
    "archetype": { "enum": ["bookcase", "cubes", "chest", "table", "apron-table", "desk", "wall-shelf", "bed", "crib", "ladder", "stool", "platform-bed", "standing-desk"] },
    "category": { "enum": ["shelving", "dressers", "bedroom", "storage", "tables", "desks", "kids"] },
    "size": { "type": "array", "items": { "type": "number" }, "minItems": 3, "maxItems": 3, "description": "Width × depth × height in cm, in the order product pages list them (beds: width × length × headboard height)" },
    "brand": { "type": "string", "description": "Brand id from data/sources/brands.json (default ikea). Sets the label and the not-affiliated line.", "default": "ikea" },
    "worksWith": { "type": "string", "pattern": "®", "description": "Works with BRAND® PRODUCT, size" },
    "instructionsUrl": { "type": "string", "pattern": "^https?://", "description": "Link to the brand's own official instructions (PDF or help page). We link it; we never copy or rehost it." },
    "productUrl": { "type": "string", "pattern": "^https://", "description": "The brand's own product page (ikea.com /p/ for IKEA; the brand site from brands.json otherwise). Never a PDF." },
    "color": { "type": "string" },
    "confidence": { "enum": ["high", "medium", "low"] },
    "sources": { "type": "array", "items": { "type": "string" }, "minItems": 1 },
    "options": { "type": "object", "description": "Archetype-specific, see docs/ARCHETYPES.md" },
    "tags": { "type": "array", "items": { "type": "string" } },
    "people": { "type": "integer" }, "minutes": { "type": "number" }, "level": { "type": "integer" },
    "done": { "type": "string" },
    "notes": { "type": "string" }
  }
}
