{
  "$schema": "../schema/catalog-spec.schema.json",
  "slug": "storkcraft-california-4-cube",
  "name": "CALIFORNIA",
  "title": "4-cube organizer bookcase",
  "brand": "storkcraft",
  "archetype": "cubes",
  "category": "kids",
  "size": [
    69.2,
    32.8,
    70.4
  ],
  "worksWith": "Storkcraft® California 4-cube organizer bookcase (03767-2171), 27.24×12.93×27.72\" (W×D×H)",
  "productUrl": "https://www.storkcraft.com/products/storkcraft®-california-cube-organizer-bookcase",
  "instructionsUrl": "https://images.salsify.com/image/upload/s--4yQkCScd--/wknyophvp4tekkhmxhrn",
  "color": "#f2f0ea",
  "confidence": "low",
  "sources": [
    "https://www.storkcraft.com/products/storkcraft®-california-cube-organizer-bookcase"
  ],
  "options": {
    "cols": 2,
    "rows": 2,
    "cell": 32.1,
    "outer": 1.8,
    "inner": 1.5
  },
  "tags": [
    "cube storage",
    "cubby",
    "bookcase",
    "organizer",
    "storkcraft",
    "nursery",
    "kids"
  ],
  "notes": "Brand page: 27.24×12.93×27.72\", four open cubbies, block feet. Feet left out of our model; cells sized from the width; board thickness is our guess.",
  "people": 2
}
